{
    "client_id": "kasasagi",
    "obligation_id": "01K63Z9W3V8Q7X1M5N2B4C6D8E",
    "source_event_type": "purchase.prepayment_approved",
    "voucher_number": 20417,
    "accounting_year": "2026",
    "supplier_number": 318,
    "entries": [
        {
            "account": 5820,
            "amount": "11287.50",
            "currency": "DKK"
        },
        {
            "account": 6800,
            "amount": "-11287.50",
            "currency": "DKK"
        }
    ]
}
